{
  "transcript": "Ravi Patel: Alright, let's get into the APAC expansion proposal. We've been circling this for two quarters and leadership wants a decision by end of month. Kenji, can you walk us through the go-to-market plan?\n\nKenji Tanaka: Sure. The proposal is to launch in Japan and Singapore first, using our existing SaaS platform with localization. We'd partner with Nomura Digital for distribution in Japan and go direct in Singapore. Target is GA by Q4 this year.\n\nSophie Laurent: Q4 is ambitious. Have we validated that our platform can handle multi-currency billing? Last I checked, the payments team said that's a six-month project minimum.\n\nKenji Tanaka: We've had preliminary conversations with the payments team. They think they can do a lightweight multi-currency layer in three months if we limit to USD, JPY, and SGD only. Full multi-currency would be Q2 next year.\n\nRavi Patel: Three months for the lightweight version — that puts us at July for payments readiness. That's tight for Q4 GA. What's the risk if payments slips?\n\nKenji Tanaka: If payments slips, we'd have to launch with USD-only billing and do manual currency conversion for Japan clients. Not ideal, but workable for the first 10-20 customers.\n\nSophie Laurent: Manual currency conversion is a compliance nightmare. Japan has strict invoicing requirements under the Qualified Invoice System. If we get that wrong, our Japanese clients can't claim tax credits on our invoices. That's a deal-breaker for enterprise buyers.\n\nDiana Osei: Singapore is easier — we can serve from our existing infrastructure with acceptable latency. No special certifications required beyond standard SOC 2, which we already have.\n\nKenji Tanaka: That's why I'd argue we should lead with Singapore and fast-follow with Japan once infrastructure and certifications are in place.\n\nRavi Patel: Let's not commit to a Japan timeline today. Kenji, can you put together a revised plan with Singapore as the lead market and Japan as a phased follow-on?\n\nKenji Tanaka: I can have a draft by next Friday.\n\nRavi Patel: Agreed. Let's reconvene in two weeks with the revised plan, infra estimates, and a legal review status update.",
  "context": "Series B SaaS company ($40M ARR) considering international expansion. Board is pushing for APAC presence to support Series C narrative.",
  "risk_tolerance": "low",
  "focus_idea": "We can launch in Singapore by Q4 using existing infrastructure and go direct without a distribution partner, then fast-follow Japan in Q2 next year.",
  "focus_questions": [
    "Can Singapore standalone generate enough revenue to justify the expansion without Japan enterprise?",
    "What happens if the lightweight multi-currency payments layer is delayed past July?",
    "Is the Nomura partnership at risk if we delay Japan by 6+ months?"
  ],
  "constraints": [
    "No additional headcount approved for APAC until Series C closes",
    "Board expects visible APAC revenue by Q1 next year"
  ]
}
